{
    "name": "spi_bus",
    "version": "1.0.0",
    "description": "A centralized, thread-safe driver for an SPI hardware bus.",
    "author": "Giorgi Magradze",
    "init_function": "spi_bus_create",
    "init_level": 10,
    "type": "drivers",
    "build_enabled": true,
    "conditional_config": "CONFIG_MODULE_SPI_BUS_ENABLED",
    "mqtt_interface": {
        "publishes": {},
        "subscribes": {}
    }
}