{
    "name": "ssd1306_driver",
    "version": "1.0.0",
    "description": "Provides a low-level driver for SSD1306 OLED displays.",
    "author": "Giorgi Magradze",
    "init_function": "ssd1306_driver_create",
    "init_level": 15,
    "type": "displays",
    "build_enabled": true,
    "conditional_config": "CONFIG_MODULE_SSD1306_DRIVER_ENABLED",
    "mqtt_interface": {
        "publishes": {},
        "subscribes": {}
    }
}