{
    "name": "button_input",
    "version": "1.0.0",
    "description": "A module to handle hardware button presses and publish events.",
    "author": "Giorgi Magradze",
    "init_function": "button_input_create",
    "init_level": 60,
    "type": "drivers",
    "build_enabled": true,
    "conditional_config": "CONFIG_MODULE_BUTTON_INPUT_ENABLED",
    "mqtt_interface": {
        "publishes": {},
        "subscribes": {}
    }
}