{
    "name": "watchdog_manager",
    "version": "1.0.0",
    "description": "Intelligent watchdog timer management with heartbeat monitoring",
    "author": "Synapse Framework Team",
    "init_function": "watchdog_manager_create",
    "init_level": 95,
    "dependencies": [],
    "type": "watchdog_manager",
    "build_enabled": true,
    "conditional_config": "CONFIG_MODULE_WATCHDOG_MANAGER_ENABLED",
    "runtime_commands": {
        "start": "watchdog_manager_start",
        "stop": "watchdog_manager_disable",
        "enable": "watchdog_manager_enable",
        "disable": "watchdog_manager_disable",
        "reconfigure": "watchdog_manager_reconfigure",
        "status": "watchdog_manager_get_status",
        "handle_event": "watchdog_manager_handle_event"
    }
}