{
    "name": "rotary_encoder_input",
    "version": "1.0.0",
    "description": "A universal module to handle rotary encoder input and publish standard navigation events.",
    "author": "Giorgi Magradze",
    "init_function": "rotary_encoder_input_create",
    "init_level": 60,
    "type": "drivers",
    "build_enabled": true,
    "conditional_config": "CONFIG_MODULE_ROTARY_ENCODER_INPUT_ENABLED",
    "mqtt_interface": {
        "publishes": {},
        "subscribes": {}
    }
}